<?xml version = "1.0" standalone="no"?>
<!-- *created  "Fri Sep  9 16:00:36 2022" *by "Paul E. Black" -->
<!-- *modified "Tue Mar 28 10:11:30 2023" *by "Paul E. Black" -->
<!DOCTYPE filtering SYSTEM "../dtd/filtering.dtd">
    <filtering>
        <sample>
            <path>
                <dir>none</dir>
            </path>
            <comment>no filtering</comment>
            <flaws>
                <flaw flaw_type="default" safe="0" unsafe="0"/>
            </flaws>
            <imports></imports>
            <code>
        # No filtering (sanitization)
        {{out_var_name}} = {{in_var_name}}
            </code>
            <input_type>string</input_type>
            <output_type>string</output_type>
        </sample>
    </filtering>

<!-- end of filtering.xml -->
