<?xml version = "1.0" standalone="no"?>
<!DOCTYPE filtering SYSTEM "../dtd/filtering.dtd">
<!-- *created  "Wed Aug  2 10:27:34 2023" *by "Paul E. Black" -->
<!-- *modified "Wed Aug  2 10:27:40 2023" *by "Paul E. Black" -->
    <filtering>

        <sample>
            <path>
                <dir>no_filtering</dir>
            </path>
            <comment>no filtering</comment>
            <flaws>
                <flaw flaw_type="default" safe="0" unsafe="0"/>
            </flaws>
            <imports></imports>
            <code>
        # No filtering (sanitization)
        {{out_var_name}} = {{in_var_name}}
            </code>
            <input_type>nofilter</input_type>
            <output_type>nofilter</output_type>
	    <options need_complexity="0" />
        </sample>

        <sample>
            <path>
                <dir>no_filter</dir>
            </path>
            <!-- empty <comment></comment> -->
            <comment></comment>
            <flaws>
                <flaw flaw_type="IDS00-PL" safe="0" unsafe="0"/>
            </flaws>
            <imports></imports>
            <code>
        # No filtering (sanitization)
        {{out_var_name}} = {{in_var_name}}
            </code>
            <input_type>nofilter</input_type>
            <output_type>nofilter</output_type>
	    <options need_complexity="0" />
        </sample>

    </filtering>
